{
  "version": "0.1",
  "epoch": "e1",
  "from_exclusive": 10,
  "through": 11,
  "events": [
    {
      "seq": 11,
      "op": "delete",
      "ref": {
        "publisher": "https://shop.example",
        "namespace": "addp",
        "id": "https://shop.example/addp/resources/o17"
      }
    }
  ],
  "more": false
}
